{
  "id": "walker-inspired-expanded",
  "name": "Modern expanded Walker-inspired curl-pattern chart",
  "code": "WALKER-EXPANDED-12",
  "description": "A common 1A–4C shorthand for describing visible natural pattern, expanded from the Walker tradition. It is a reference vocabulary, not a diagnosis or a measure of strand properties."
}
